{
  "version": "1.0.0",
  "preset": "gW_eN",
  "seed": 1,
  "objective": 1452.0,
  "levels": 1,
  "wall_height_m": 2.7,
  "plot": {
    "width_m": 16.0,
    "depth_m": 12.0
  },
  "orientation": "N",
  "rooms": [
    {
      "name": "Living",
      "category": "living",
      "rect_m": [
        7.0,
        0.0,
        12.0,
        6.5
      ],
      "zone": "living"
    },
    {
      "name": "Dining",
      "category": "living",
      "rect_m": [
        4.0,
        0.0,
        7.0,
        6.5
      ],
      "zone": "dining"
    },
    {
      "name": "Kitchen",
      "category": "wet",
      "rect_m": [
        5.5,
        6.5,
        10.5,
        10.0
      ],
      "zone": "kitchen_laundry"
    },
    {
      "name": "Laundry",
      "category": "service",
      "rect_m": [
        5.5,
        10.0,
        10.5,
        12.0
      ],
      "zone": "kitchen_laundry"
    },
    {
      "name": "Master Bedroom",
      "category": "private",
      "rect_m": [
        0.0,
        0.0,
        4.0,
        4.0
      ],
      "zone": "master_suite"
    },
    {
      "name": "Master Bathroom",
      "category": "wet",
      "rect_m": [
        0.0,
        4.0,
        2.0,
        6.5
      ],
      "zone": "master_suite"
    },
    {
      "name": "Walk-in Closet",
      "category": "private",
      "rect_m": [
        2.0,
        4.0,
        4.0,
        6.5
      ],
      "zone": "master_suite"
    },
    {
      "name": "Bedroom 2",
      "category": "private",
      "rect_m": [
        12.0,
        0.0,
        16.0,
        2.0
      ],
      "zone": "children"
    },
    {
      "name": "Bathroom",
      "category": "wet",
      "rect_m": [
        12.0,
        2.0,
        16.0,
        4.0
      ],
      "zone": "children"
    },
    {
      "name": "Bedroom 3",
      "category": "private",
      "rect_m": [
        12.0,
        4.0,
        16.0,
        6.5
      ],
      "zone": "children"
    },
    {
      "name": "Office",
      "category": "office",
      "rect_m": [
        13.5,
        6.5,
        16.0,
        12.0
      ],
      "zone": "office"
    },
    {
      "name": "Mudroom",
      "category": "service",
      "rect_m": [
        10.5,
        6.5,
        12.0,
        12.0
      ],
      "zone": "entry"
    },
    {
      "name": "Foyer",
      "category": "circ",
      "rect_m": [
        12.0,
        6.5,
        13.5,
        12.0
      ],
      "zone": "entry"
    },
    {
      "name": "Garage",
      "category": "service",
      "rect_m": [
        0.0,
        6.5,
        5.5,
        12.0
      ],
      "zone": "garage"
    }
  ],
  "walls": [
    {
      "id": "w1",
      "start": [
        0.0,
        0.0
      ],
      "end": [
        0.0,
        4.0
      ],
      "thickness_m": 0.3,
      "height_m": 2.7,
      "exterior": true
    },
    {
      "id": "w2",
      "start": [
        0.0,
        4.0
      ],
      "end": [
        0.0,
        6.5
      ],
      "thickness_m": 0.3,
      "height_m": 2.7,
      "exterior": true
    },
    {
      "id": "w3",
      "start": [
        0.0,
        6.5
      ],
      "end": [
        0.0,
        12.0
      ],
      "thickness_m": 0.3,
      "height_m": 2.7,
      "exterior": true
    },
    {
      "id": "w4",
      "start": [
        2.0,
        4.0
      ],
      "end": [
        2.0,
        6.5
      ],
      "thickness_m": 0.15,
      "height_m": 2.7,
      "exterior": false
    },
    {
      "id": "w5",
      "start": [
        4.0,
        0.0
      ],
      "end": [
        4.0,
        4.0
      ],
      "thickness_m": 0.15,
      "height_m": 2.7,
      "exterior": false
    },
    {
      "id": "w6",
      "start": [
        4.0,
        4.0
      ],
      "end": [
        4.0,
        6.5
      ],
      "thickness_m": 0.15,
      "height_m": 2.7,
      "exterior": false
    },
    {
      "id": "w7",
      "start": [
        5.5,
        6.5
      ],
      "end": [
        5.5,
        10.0
      ],
      "thickness_m": 0.15,
      "height_m": 2.7,
      "exterior": false
    },
    {
      "id": "w8",
      "start": [
        5.5,
        10.0
      ],
      "end": [
        5.5,
        12.0
      ],
      "thickness_m": 0.15,
      "height_m": 2.7,
      "exterior": false
    },
    {
      "id": "w9",
      "start": [
        7.0,
        0.0
      ],
      "end": [
        7.0,
        6.5
      ],
      "thickness_m": 0.15,
      "height_m": 2.7,
      "exterior": false
    },
    {
      "id": "w10",
      "start": [
        10.5,
        6.5
      ],
      "end": [
        10.5,
        10.0
      ],
      "thickness_m": 0.15,
      "height_m": 2.7,
      "exterior": false
    },
    {
      "id": "w11",
      "start": [
        10.5,
        10.0
      ],
      "end": [
        10.5,
        12.0
      ],
      "thickness_m": 0.15,
      "height_m": 2.7,
      "exterior": false
    },
    {
      "id": "w12",
      "start": [
        12.0,
        0.0
      ],
      "end": [
        12.0,
        2.0
      ],
      "thickness_m": 0.15,
      "height_m": 2.7,
      "exterior": false
    },
    {
      "id": "w13",
      "start": [
        12.0,
        2.0
      ],
      "end": [
        12.0,
        4.0
      ],
      "thickness_m": 0.15,
      "height_m": 2.7,
      "exterior": false
    },
    {
      "id": "w14",
      "start": [
        12.0,
        4.0
      ],
      "end": [
        12.0,
        6.5
      ],
      "thickness_m": 0.15,
      "height_m": 2.7,
      "exterior": false
    },
    {
      "id": "w15",
      "start": [
        12.0,
        6.5
      ],
      "end": [
        12.0,
        12.0
      ],
      "thickness_m": 0.15,
      "height_m": 2.7,
      "exterior": false
    },
    {
      "id": "w16",
      "start": [
        13.5,
        6.5
      ],
      "end": [
        13.5,
        12.0
      ],
      "thickness_m": 0.15,
      "height_m": 2.7,
      "exterior": false
    },
    {
      "id": "w17",
      "start": [
        16.0,
        0.0
      ],
      "end": [
        16.0,
        2.0
      ],
      "thickness_m": 0.3,
      "height_m": 2.7,
      "exterior": true
    },
    {
      "id": "w18",
      "start": [
        16.0,
        2.0
      ],
      "end": [
        16.0,
        4.0
      ],
      "thickness_m": 0.3,
      "height_m": 2.7,
      "exterior": true
    },
    {
      "id": "w19",
      "start": [
        16.0,
        4.0
      ],
      "end": [
        16.0,
        6.5
      ],
      "thickness_m": 0.3,
      "height_m": 2.7,
      "exterior": true
    },
    {
      "id": "w20",
      "start": [
        16.0,
        6.5
      ],
      "end": [
        16.0,
        12.0
      ],
      "thickness_m": 0.3,
      "height_m": 2.7,
      "exterior": true
    },
    {
      "id": "w21",
      "start": [
        0.0,
        0.0
      ],
      "end": [
        4.0,
        0.0
      ],
      "thickness_m": 0.3,
      "height_m": 2.7,
      "exterior": true
    },
    {
      "id": "w22",
      "start": [
        4.0,
        0.0
      ],
      "end": [
        7.0,
        0.0
      ],
      "thickness_m": 0.3,
      "height_m": 2.7,
      "exterior": true
    },
    {
      "id": "w23",
      "start": [
        7.0,
        0.0
      ],
      "end": [
        12.0,
        0.0
      ],
      "thickness_m": 0.3,
      "height_m": 2.7,
      "exterior": true
    },
    {
      "id": "w24",
      "start": [
        12.0,
        0.0
      ],
      "end": [
        16.0,
        0.0
      ],
      "thickness_m": 0.3,
      "height_m": 2.7,
      "exterior": true
    },
    {
      "id": "w25",
      "start": [
        12.0,
        2.0
      ],
      "end": [
        16.0,
        2.0
      ],
      "thickness_m": 0.15,
      "height_m": 2.7,
      "exterior": false
    },
    {
      "id": "w26",
      "start": [
        0.0,
        4.0
      ],
      "end": [
        2.0,
        4.0
      ],
      "thickness_m": 0.15,
      "height_m": 2.7,
      "exterior": false
    },
    {
      "id": "w27",
      "start": [
        2.0,
        4.0
      ],
      "end": [
        4.0,
        4.0
      ],
      "thickness_m": 0.15,
      "height_m": 2.7,
      "exterior": false
    },
    {
      "id": "w28",
      "start": [
        12.0,
        4.0
      ],
      "end": [
        16.0,
        4.0
      ],
      "thickness_m": 0.15,
      "height_m": 2.7,
      "exterior": false
    },
    {
      "id": "w29",
      "start": [
        0.0,
        6.5
      ],
      "end": [
        2.0,
        6.5
      ],
      "thickness_m": 0.15,
      "height_m": 2.7,
      "exterior": false
    },
    {
      "id": "w30",
      "start": [
        2.0,
        6.5
      ],
      "end": [
        4.0,
        6.5
      ],
      "thickness_m": 0.15,
      "height_m": 2.7,
      "exterior": false
    },
    {
      "id": "w31",
      "start": [
        4.0,
        6.5
      ],
      "end": [
        5.5,
        6.5
      ],
      "thickness_m": 0.15,
      "height_m": 2.7,
      "exterior": false
    },
    {
      "id": "w32",
      "start": [
        5.5,
        6.5
      ],
      "end": [
        7.0,
        6.5
      ],
      "thickness_m": 0.15,
      "height_m": 2.7,
      "exterior": false
    },
    {
      "id": "w33",
      "start": [
        7.0,
        6.5
      ],
      "end": [
        10.5,
        6.5
      ],
      "thickness_m": 0.15,
      "height_m": 2.7,
      "exterior": false
    },
    {
      "id": "w34",
      "start": [
        10.5,
        6.5
      ],
      "end": [
        12.0,
        6.5
      ],
      "thickness_m": 0.15,
      "height_m": 2.7,
      "exterior": false
    },
    {
      "id": "w35",
      "start": [
        12.0,
        6.5
      ],
      "end": [
        13.5,
        6.5
      ],
      "thickness_m": 0.15,
      "height_m": 2.7,
      "exterior": false
    },
    {
      "id": "w36",
      "start": [
        13.5,
        6.5
      ],
      "end": [
        16.0,
        6.5
      ],